id,name,namespace,def
GO:0016887,ATP hydrolysis activity,molecular_function,"Catalysis of the reaction: ATP + H2O = ADP + H+ phosphate. ATP hydrolysis is used in some reactions as an energy source, for example to catalyze a reaction or drive transport against a concentration gradient. [RHEA:13065]"
GO:0016922,nuclear receptor binding,molecular_function,Binding to a nuclear receptor protein. Nuclear receptor proteins are DNA-binding transcription factors which are regulated by binding to a ligand. [PMID:7776974]
GO:0017018,myosin phosphatase activity,molecular_function,Catalysis of the reaction: phosphomyosin + H2O = myosin + phosphate. [EC:3.1.3.16]
GO:0017022,myosin binding,molecular_function,Binding to a myosin; myosins are any of a superfamily of molecular motor proteins that bind to actin and use the energy of ATP hydrolysis to generate force and movement along actin filaments. [GOC:mah]
GO:0017025,TBP-class protein binding,molecular_function,"Binding to a member of the class of TATA-binding proteins (TBP), including any of the TBP-related factors (TRFs). [GOC:jl, GOC:txnOH, http://www.mblab.gla.ac.uk/, PMID:16858867]"
GO:0017046,peptide hormone binding,molecular_function,"Binding to a peptide with hormonal activity in animals. [GOC:jl, ISBN:0198506732]"
GO:0017056,structural constituent of nuclear pore,molecular_function,"The action of a molecule that contributes to the structural integrity of the nuclear pore complex, a protein-lined channel in the nuclear envelope that allows the transfer of macromolecules. [GOC:mah, PMID:25802992]"
GO:0017075,syntaxin-1 binding,molecular_function,Binding to a syntaxin-1 SNAP receptor. [GOC:ai]
GO:0017080,sodium channel regulator activity,molecular_function,Binds to and modulates the activity of a sodium channel. [GOC:mah]
GO:0017116,single-stranded DNA helicase activity,molecular_function,"Catalysis of the reaction: ATP + H2O = ADP + phosphate, in the presence of single-stranded DNA; drives the unwinding of a DNA helix. [GOC:jl]"
GO:0017124,SH3 domain binding,molecular_function,"Binding to a SH3 domain (Src homology 3) of a protein, small protein modules containing approximately 50 amino acid residues found in a great variety of intracellular or membrane-associated proteins. [GOC:go_curators, Pfam:PF00018]"
GO:0017134,fibroblast growth factor binding,molecular_function,Binding to a fibroblast growth factor. [PMID:9806903]
GO:0017147,Wnt-protein binding,molecular_function,"Binding to a Wnt-protein, a secreted growth factor involved in signaling. [GOC:jl]"
GO:0018024,obsolete histone lysine N-methyltransferase activity,molecular_function,"OBSOLETE. Catalysis of the reaction: S-adenosyl-L-methionine + histone L-lysine = S-adenosyl-L-homocysteine + histone N6-methyl-L-lysine. The methylation of peptidyl-lysine in histones forms N6-methyl-L-lysine, N6,N6-dimethyl-L-lysine and N6,N6,N6-trimethyl-L-lysine derivatives. [RHEA:10024]"
GO:0019003,GDP binding,molecular_function,"Binding to GDP, guanosine 5'-diphosphate. [GOC:ai]"
GO:0019706,protein-cysteine S-palmitoyltransferase activity,molecular_function,"Catalysis of the transfer of a palmitoyl (systematic name, hexadecanoyl) group to a sulfur atom on the cysteine of a protein molecule, in the reaction hexadecanoyl-CoA + L-cysteinyl-[protein] = CoA + S-hexadecanoyl-L-cysteinyl-[protein]. [GOC:ai, GOC:pr, RHEA:36683]"
GO:0019789,SUMO transferase activity,molecular_function,"Catalysis of the transfer of SUMO from one protein to another via the reaction X-SUMO + Y = Y-SUMO + X, where both X-SUMO and Y-SUMO are covalent linkages. [GOC:rn, PMID:11031248, PMID:11265250]"
GO:0019825,oxygen binding,molecular_function,Binding to oxygen (O2). [GOC:jl]
GO:0019838,growth factor binding,molecular_function,"Binding to a growth factor, proteins or polypeptides that stimulate a cell or organism to grow or proliferate. [GOC:curators]"
GO:0019843,rRNA binding,molecular_function,Binding to a ribosomal RNA. [GOC:jl]
GO:0019888,protein phosphatase regulator activity,molecular_function,Binds to and modulates the activity of a protein phosphatase. [GOC:ai]
GO:0019894,kinesin binding,molecular_function,"Interacting selectively and non-covalently and stoichiometrically with kinesin, a member of a superfamily of microtubule-based motor proteins that perform force-generating tasks such as organelle transport and chromosome segregation. [GOC:curators, PMID:8606779]"
GO:0019899,enzyme binding,molecular_function,"Binding to an enzyme, a protein with catalytic activity. [GOC:jl]"
GO:0019900,kinase binding,molecular_function,"Binding to a kinase, any enzyme that catalyzes the transfer of a phosphate group. [GOC:jl]"
GO:0019901,protein kinase binding,molecular_function,"Binding to a protein kinase, any enzyme that catalyzes the transfer of a phosphate group, usually from ATP, to a protein substrate. [GOC:jl]"
GO:0019902,phosphatase binding,molecular_function,Binding to a phosphatase. [GOC:jl]
GO:0019903,protein phosphatase binding,molecular_function,Binding to a protein phosphatase. [GOC:jl]
GO:0019904,protein domain specific binding,molecular_function,Binding to a specific domain of a protein. [GOC:go_curators]
GO:0019905,syntaxin binding,molecular_function,"Binding to a syntaxin, a SNAP receptor involved in the docking of synaptic vesicles at the presynaptic zone of a synapse. [ISBN:0198506732]"
GO:0019955,cytokine binding,molecular_function,"Binding to a cytokine, any of a group of proteins that function to control the survival, growth and differentiation of tissues and cells, and which have autocrine and paracrine activity. [GOC:ai, GOC:bf, ISBN:0198599471]"
GO:0020037,heme binding,molecular_function,"Binding to a heme, a compound composed of iron complexed in a porphyrin (tetrapyrrole) ring. [GOC:ai]"
GO:0022857,transmembrane transporter activity,molecular_function,"Enables the transfer of a substance, usually a specific substance or a group of related substances, from one side of a membrane to the other. [GOC:jid, GOC:mtg_transport, ISBN:0815340729]"
GO:0023026,MHC class II protein complex binding,molecular_function,"Binding to a class II major histocompatibility complex. [GOC:mtg_signal, GOC:vw]"
GO:0030020,extracellular matrix structural constituent conferring tensile strength,molecular_function,"A constituent of the extracellular matrix that enables the matrix to resist longitudinal stress. [GOC:mah, ISBN:0815316194]"
GO:0030145,manganese ion binding,molecular_function,Binding to a manganese ion (Mn). [GOC:ai]
GO:0030159,signaling receptor complex adaptor activity,molecular_function,The binding activity of a molecule that provides a physical support for the assembly of a multiprotein receptor signaling complex. [GOC:mah]
GO:0030165,PDZ domain binding,molecular_function,"Binding to a PDZ domain of a protein, a domain found in diverse signaling proteins. [GOC:go_curators, Pfam:PF00595]"
GO:0030170,pyridoxal phosphate binding,molecular_function,"Binding to pyridoxal 5' phosphate, 3-hydroxy-5-(hydroxymethyl)-2-methyl4-pyridine carboxaldehyde 5' phosphate, the biologically active form of vitamin B6. [GOC:mah, ISBN:0198506732]"
GO:0030215,semaphorin receptor binding,molecular_function,"Binding to a semaphorin receptor. [GOC:ceb, PMID:12001990]"
GO:0030234,enzyme regulator activity,molecular_function,"Binds to and modulates the activity of an enzyme. [GOC:dph, GOC:mah, GOC:tb]"
GO:0030246,carbohydrate binding,molecular_function,"Binding to a carbohydrate, which includes monosaccharides, oligosaccharides and polysaccharides as well as substances derived from monosaccharides by reduction of the carbonyl group (alditols), by oxidation of one or more hydroxy groups to afford the corresponding aldehydes, ketones, or carboxylic acids, or by replacement of one or more hydroxy group(s) by a hydrogen atom. Cyclitols are generally not regarded as carbohydrates. [GOC:mah]"
GO:0030276,clathrin binding,molecular_function,"Binding to a clathrin heavy or light chain, the main components of the coat of coated vesicles and coated pits, and which also occurs in synaptic vesicles. [GOC:jl, GOC:mah, ISBN:0198506732]"
GO:0030280,structural constituent of skin epidermis,molecular_function,The action of a molecule that contributes to the structural integrity of an epidermal cutaneous structure. [GOC:mah]
GO:0030295,protein kinase activator activity,molecular_function,"Binds to and increases the activity of a protein kinase, an enzyme which phosphorylates a protein. [GOC:ai]"
GO:0030331,nuclear estrogen receptor binding,molecular_function,Binding to a nuclear estrogen receptor. [GOC:ai]
GO:0030332,cyclin binding,molecular_function,"Binding to cyclins, proteins whose levels in a cell varies markedly during the cell cycle, rising steadily until mitosis, then falling abruptly to zero. As cyclins reach a threshold level, they are thought to drive cells into G2 phase and thus to mitosis. [GOC:ai]"
GO:0030374,nuclear receptor coactivator activity,molecular_function,"A transcription coactivator activity that activates or increases the transcription of specific gene sets via binding to a DNA-bound nuclear receptor, either on its own or as part of a complex. Coactivators often act by altering chromatin structure and modifications. For example, one class of transcription coregulators modifies chromatin structure through covalent modification of histones. A second class remodels the conformation of chromatin in an ATP-dependent fashion. A third class modulates interactions of DNA-bound DNA-binding transcription factors with other transcription coregulators. A fourth class of coactivator activity is the bridging of a DNA-binding transcription factor to the general (basal) transcription machinery. The Mediator complex, which bridges sequence-specific DNA binding transcription factors and RNA polymerase, is also a transcription coactivator. [GOC:dph, GOC:tb]"
GO:0030507,spectrin binding,molecular_function,"Binding to spectrin, a protein that is the major constituent of the erythrocyte cytoskeletal network. It associates with band 4.1 (see band protein) and actin to form the cytoskeletal superstructure of the erythrocyte plasma membrane. It is composed of nonhomologous chains, alpha and beta, which aggregate side-to-side in an antiparallel fashion to form dimers, tetramers, and higher polymers. [GOC:mah, ISBN:0198506732]"
GO:0030515,snoRNA binding,molecular_function,Binding to a small nucleolar RNA. [GOC:mah]
GO:0030527,structural constituent of chromatin,molecular_function,The action of a molecule that contributes to the structural integrity of chromatin. [GOC:ai]
GO:0030544,Hsp70 protein binding,molecular_function,"Binding to a Hsp70 protein, heat shock proteins around 70kDa in size. [ISBN:0198506732]"
GO:0030594,neurotransmitter receptor activity,molecular_function,"Combining with a neurotransmitter and transmitting the signal to initiate a change in cell activity. [GOC:jl, GOC:signaling]"
GO:0030674,protein-macromolecule adaptor activity,molecular_function,"The binding activity of a protein that brings together two or more macromolecules in contact, permitting those molecules to function in a coordinated way. The adaptor can bring together two proteins, or a protein and another macromolecule such as a lipid or a nucleic acid. [GOC:bf, GOC:mah, GOC:vw]"
GO:0030742,GTP-dependent protein binding,molecular_function,"Binding to a protein or protein complex when at least one of the interacting partners is in the GTP-bound state. [GOC:go_curators, GOC:krc]"
GO:0030971,receptor tyrosine kinase binding,molecular_function,Binding to a receptor that possesses protein tyrosine kinase activity. [GOC:mah]
GO:0031072,heat shock protein binding,molecular_function,"Binding to a heat shock protein, a protein synthesized or activated in response to heat shock. [GOC:mah, GOC:vw]"
GO:0031210,phosphatidylcholine binding,molecular_function,"Binding to a phosphatidylcholine, a glycophospholipid in which a phosphatidyl group is esterified to the hydroxyl group of choline. [GOC:mah, ISBN:0198506732]"
GO:0031267,small GTPase binding,molecular_function,"Binding to a small monomeric GTPase. [GOC:mah, PMID:27218782]"
GO:0031369,translation initiation factor binding,molecular_function,"Binding to a translation initiation factor, any polypeptide factor involved in the initiation of ribosome-mediated translation. [GOC:mah]"
GO:0031418,L-ascorbic acid binding,molecular_function,"Binding to L-ascorbic acid, (2R)-2-[(1S)-1,2-dihydroxyethyl]-4-hydroxy-5-oxo-2,5-dihydrofuran-3-olate; L-ascorbic acid is vitamin C and has co-factor and anti-oxidant activities in many species. [GOC:mah]"
GO:0031490,chromatin DNA binding,molecular_function,Binding to DNA that is assembled into chromatin. [GOC:mah]
GO:0031491,nucleosome binding,molecular_function,"Binding to a nucleosome, a complex comprised of DNA wound around a multisubunit core and associated proteins, which forms the primary packing unit of DNA into higher order structures. [GOC:mah]"
GO:0031492,nucleosomal DNA binding,molecular_function,Binding to the DNA portion of a nucleosome. [GOC:mah]
GO:0031593,polyubiquitin modification-dependent protein binding,molecular_function,Binding to a protein upon poly-ubiquitination of the target protein. [GOC:pg]
GO:0031624,ubiquitin conjugating enzyme binding,molecular_function,"Binding to a ubiquitin conjugating enzyme, any of the E2 proteins. [GOC:vp]"
GO:0031625,ubiquitin protein ligase binding,molecular_function,"Binding to a ubiquitin protein ligase enzyme, any of the E3 proteins. [GOC:vp]"
GO:0031681,G-protein beta-subunit binding,molecular_function,Binding to a G-protein beta subunit. [GOC:mah]
GO:0031683,G-protein beta/gamma-subunit complex binding,molecular_function,"Binding to a complex of G-protein beta/gamma subunits. [GOC:nln, GOC:vw]"
GO:0032266,phosphatidylinositol-3-phosphate binding,molecular_function,"Binding to phosphatidylinositol-3-phosphate, a derivative of phosphatidylinositol in which the inositol ring is phosphorylated at the 3' position. [GOC:bf, PMID:10209156, PMID:11395417, PMID:11557775]"
GO:0032452,histone demethylase activity,molecular_function,Catalysis of the removal of a methyl group from a histone. [GOC:mah]
GO:0033038,bitter taste receptor activity,molecular_function,Combining with soluble bitter compounds to initiate a change in cell activity. These receptors are responsible for the sense of bitter taste. [GOC:mah]
GO:0033691,sialic acid binding,molecular_function,"Binding to a sialic acid, a N- or O- substituted derivative of neuraminic acid, a nine carbon monosaccharide. Sialic acids often occur in polysaccharides, glycoproteins, and glycolipids in animals and bacteria. [GOC:add, ISBN:9780721601465]"
GO:0034237,protein kinase A regulatory subunit binding,molecular_function,Binding to one or both of the regulatory subunits of protein kinase A. [GOC:mah]
GO:0035035,histone acetyltransferase binding,molecular_function,Binding to an histone acetyltransferase. [GOC:bf]
GO:0035064,methylated histone binding,molecular_function,"Binding to a histone in which a residue has been modified by methylation. [GOC:bf, PMID:14585615]"
GO:0035091,phosphatidylinositol binding,molecular_function,"Binding to an inositol-containing glycerophospholipid, i.e. phosphatidylinositol (PtdIns) and its phosphorylated derivatives. [GOC:bf, ISBN:0198506732, PMID:11395417]"
GO:0035198,miRNA binding,molecular_function,"Binding to a microRNA, a 21-23 nucleotide RNA that is processed from a stem-loop RNA precursor (pre-miRNA) that is encoded within plant and animal genomes. [PMID:15066283]"
GO:0035255,ionotropic glutamate receptor binding,molecular_function,"Binding to an ionotropic glutamate receptor. Ionotropic glutamate receptors bind glutamate and exert an effect through the regulation of ion channels. [GOC:bf, ISBN:0198506732]"
GO:0035591,signaling adaptor activity,molecular_function,"The binding activity of a molecule that brings together two or more molecules in a signaling pathway, permitting those molecules to function in a coordinated way. Adaptor molecules themselves do not have catalytic activity. [GOC:bf, PMID:19104498]"
GO:0035925,mRNA 3'-UTR AU-rich region binding,molecular_function,"Binding to a region containing frequent adenine and uridine bases within the 3' untranslated region of a mRNA molecule or in pre-mRNA intron. The ARE-binding element consensus is UUAUUUAUU. ARE-binding proteins control the stability and/or translation of mRNAs. [GOC:vw, PMID:31511872, PMID:7892223, PMID:8578590]"
GO:0036094,small molecule binding,molecular_function,"Binding to a small molecule, any low molecular weight, monomeric, non-encoded molecule. [GOC:curators, GOC:pde, GOC:pm]"
GO:0038023,signaling receptor activity,molecular_function,"Receiving a signal and transmitting it in the cell to initiate a change in cell activity. A signal is a physical entity or change in state that is used to transfer information in order to trigger a response. [GOC:bf, GOC:signaling]"
GO:0038024,cargo receptor activity,molecular_function,"Binding specifically to a substance (cargo) to deliver it to a transport vesicle. Cargo receptors span a membrane (either the plasma membrane or a vesicle membrane), binding simultaneously to cargo molecules and coat adaptors, to efficiently recruit soluble proteins to nascent vesicles. [PMID:15239958, PMID:27903609]"
GO:0042056,chemoattractant activity,molecular_function,"Providing the environmental signal that initiates the directed movement of a motile cell or organism towards a higher concentration of that signal. [GOC:go_curators, ISBN:0198506732]"
GO:0042162,telomeric DNA binding,molecular_function,"Binding to a telomere, a specific structure at the end of a linear chromosome required for the integrity and maintenance of the end. [GOC:jl, SO:0000624]"
GO:0042169,SH2 domain binding,molecular_function,"Binding to a SH2 domain (Src homology 2) of a protein, a protein domain of about 100 amino-acid residues and belonging to the alpha + beta domain class. [GOC:go_curators, Pfam:PF00017]"
GO:0042277,peptide binding,molecular_function,"Binding to a peptide, an organic compound comprising two or more amino acids linked by peptide bonds. [GOC:jl]"
GO:0042393,histone binding,molecular_function,"Binding to a histone, any of a group of water-soluble proteins found in association with the DNA of eukaryotic or archaeal chromosomes. They are involved in the condensation and coiling of chromosomes during cell division and have also been implicated in gene regulation and DNA replication. They may be chemically modified (methylated, acetlyated and others) to regulate gene transcription. [GOC:jl, PMID:16209651, PMID:30212449, PMID:9305837]"
GO:0042605,peptide antigen binding,molecular_function,"Binding to an antigen peptide. [GOC:add, GOC:jl, GOC:rv]"
GO:0042626,ATPase-coupled transmembrane transporter activity,molecular_function,"Primary active transporter of a solute across a membrane, via the reaction: ATP + H2O = ADP + phosphate, to directly drive the transport of a substance across a membrane. The transport protein may be transiently phosphorylated (P-type transporters), or not (ABC-type transporters and other families of transporters). Primary active transport occurs up the solute's concentration gradient and is driven by a primary energy source. [GOC:mtg_transport, ISBN:0815340729]"
GO:0042826,histone deacetylase binding,molecular_function,Binding to histone deacetylase. [GOC:jl]
GO:0042923,neuropeptide binding,molecular_function,"Interacting selectively and non-covalently and stoichiometrically with neuropeptides, peptides with direct synaptic effects (peptide neurotransmitters) or indirect modulatory effects on the nervous system (peptide neuromodulators). [http://www.wormbook.org/chapters/www_neuropeptides/neuropeptides.html]"
GO:0043014,alpha-tubulin binding,molecular_function,Binding to the microtubule constituent protein alpha-tubulin. [GOC:jl]
GO:0043015,gamma-tubulin binding,molecular_function,Binding to the microtubule constituent protein gamma-tubulin. [GOC:jl]
GO:0043021,ribonucleoprotein complex binding,molecular_function,"Binding to a complex of RNA and protein. [GOC:bf, GOC:go_curators, GOC:vk]"
GO:0043022,ribosome binding,molecular_function,Binding to a ribosome. [GOC:go_curators]
GO:0043027,cysteine-type endopeptidase inhibitor activity involved in apoptotic process,molecular_function,"Binds to and stops, prevents or reduces the activity of a cysteine-type endopeptidase involved in the apoptotic process. [GOC:jl, GOC:mtg_apoptosis, PMID:14744432, Wikipedia:Caspase]"
GO:0043130,ubiquitin binding,molecular_function,"Binding to ubiquitin, a protein that when covalently bound to other cellular proteins marks them for proteolytic degradation. [GOC:ecd]"
GO:0043236,laminin binding,molecular_function,"Binding to a laminin, a major glycoprotein constituent of the basement membrane of cells. [GOC:ecd]"
GO:0043274,phospholipase binding,molecular_function,Binding to a phospholipase. [GOC:jl]
GO:0043325,"phosphatidylinositol-3,4-bisphosphate binding",molecular_function,"Binding to phosphatidylinositol-3,4-bisphosphate, a derivative of phosphatidylinositol in which the inositol ring is phosphorylated at the 3' and 4' positions. [GOC:bf, GOC:go_curators]"
GO:0043425,bHLH transcription factor binding,molecular_function,"Binding to a basic Helix-Loop-Helix (bHLH) superfamily of transcription factors, important regulatory components in transcriptional networks of many developmental pathways. [PMID:9144210]"
GO:0043531,ADP binding,molecular_function,"Binding to ADP, adenosine 5'-diphosphate. [GOC:jl]"
GO:0043539,protein serine/threonine kinase activator activity,molecular_function,Binds to and increases the activity of a protein serine/threonine kinase. [GOC:go_curators]
GO:0043565,sequence-specific DNA binding,molecular_function,"Binding to DNA of a specific nucleotide composition, e.g. GC-rich DNA binding, or with a specific sequence motif or type of DNA e.g. promotor binding or rDNA binding. [GOC:jl]"
GO:0043621,protein self-association,molecular_function,Binding to a domain within the same polypeptide. [GOC:jl]
GO:0044183,protein folding chaperone,molecular_function,Binding to a protein or a protein-containing complex to assist the protein folding process. [GOC:mtg_cambridge_2009]
GO:0044325,transmembrane transporter binding,molecular_function,"Binding to a transmembrane transporter, a protein or protein complex that enables the transfer of a substance, usually a specific substance or a group of related substances, from one side of a membrane to the other. [GOC:BHF, GOC:jl, PMID:33199372]"
GO:0044389,ubiquitin-like protein ligase binding,molecular_function,"Binding to a ubiquitin-like protein ligase, such as ubiquitin-ligase. [GOC:jl]"
GO:0044877,protein-containing complex binding,molecular_function,Binding to a macromolecular complex. [GOC:jl]
GO:0045182,translation regulator activity,molecular_function,"Any molecular function involved in the initiation, activation, perpetuation, repression or termination of polypeptide synthesis at the ribosome. [GOC:ai]"
GO:0045296,cadherin binding,molecular_function,"Binding to cadherin, a type I membrane protein involved in cell adhesion. [GOC:bf]"
GO:0045499,chemorepellent activity,molecular_function,Providing the environmental signal that initiates the directed movement of a motile cell or organism towards a lower concentration of that signal. [GOC:ai]
GO:0045505,dynein intermediate chain binding,molecular_function,Binding to an intermediate chain of the dynein complex. [GOC:bf]
GO:0046332,SMAD binding,molecular_function,Binding to a SMAD signaling protein. [GOC:ai]
GO:0046875,ephrin receptor binding,molecular_function,Binding to an ephrin receptor. [GOC:ai]
GO:0046961,"proton-transporting ATPase activity, rotational mechanism",molecular_function,"Enables the transfer of protons from one side of a membrane to the other according to the reaction: ATP + H2O + H+(in) -> ADP + phosphate + H+(out), by a rotational mechanism. [RHEA:57721]"
GO:0046966,nuclear thyroid hormone receptor binding,molecular_function,Binding to a nuclear thyroid hormone receptor. [GOC:ai]
GO:0046982,protein heterodimerization activity,molecular_function,Binding to a nonidentical protein to form a heterodimer. [GOC:ai]
GO:0046983,protein dimerization activity,molecular_function,"The formation of a protein dimer, a macromolecular structure consists of two noncovalently associated identical or nonidentical subunits. [ISBN:0198506732]"
GO:0047485,obsolete protein N-terminus binding,molecular_function,"OBSOLETE. Binding to a protein N-terminus, the end of any peptide chain at which the 2-amino (or 2-imino) function of a constituent amino acid is not attached in peptide linkage to another amino-acid residue. [ISBN:0198506732]"
GO:0048018,receptor ligand activity,molecular_function,"The activity of a gene product that interacts with a receptor to effect a change in the activity of the receptor. Ligands may be produced by the same, or different, cell that expresses the receptor. Ligands may diffuse extracellularly from their point of origin to the receiving cell, or remain attached to an adjacent cell surface (e.g. Notch ligands). [GOC:kv, GOC:molecular_function_refactoring, GOC:pdt]"
GO:0048020,CCR chemokine receptor binding,molecular_function,Binding to a CCR chemokine receptor. [GOC:ai]
GO:0048027,mRNA 5'-UTR binding,molecular_function,Binding to an mRNA molecule at its 5' untranslated region. [GOC:jid]
GO:0048156,tau protein binding,molecular_function,"Binding to tau protein. tau is a microtubule-associated protein, implicated in Alzheimer's disease, Down Syndrome and ALS. [GOC:jid]"
GO:0048306,calcium-dependent protein binding,molecular_function,"Binding to a protein or protein complex in the presence of calcium. [GOC:jid, PMID:10485905]"
GO:0048487,beta-tubulin binding,molecular_function,Binding to the microtubule constituent protein beta-tubulin. [GOC:krc]
