id,name,namespace,def
GO:0005085,guanyl-nucleotide exchange factor activity,molecular_function,"Stimulates the exchange of GDP to GTP on a signaling GTPase, changing its conformation to its active form. Guanine nucleotide exchange factors (GEFs) act by stimulating the release of guanosine diphosphate (GDP) to allow binding of guanosine triphosphate (GTP), which is more abundant in the cell under normal cellular physiological conditions. [GOC:kd, GOC:mah, PMID:23303910, PMID:27218782]"
GO:0005096,GTPase activator activity,molecular_function,"Binds to and increases the activity of a GTPase, an enzyme that catalyzes the hydrolysis of GTP. [GOC:mah]"
GO:0005102,signaling receptor binding,molecular_function,"Binding to one or more specific sites on a receptor molecule, a macromolecule that undergoes combination with a hormone, neurotransmitter, drug or intracellular messenger to initiate a change in cell function. [GOC:bf, GOC:ceb, ISBN:0198506732]"
GO:0005109,frizzled binding,molecular_function,Binding to a frizzled (fz) receptor. [GOC:ceb]
GO:0005112,Notch binding,molecular_function,"Binding to a Notch (N) protein, a surface receptor. [GOC:ceb]"
GO:0005125,cytokine activity,molecular_function,"The activity of a soluble extracellular gene product that interacts with a receptor to effect a change in the activity of the receptor to control the survival, growth, differentiation and effector function of tissues and cells. [ISBN:0198599471, PMID:11530802]"
GO:0005154,epidermal growth factor receptor binding,molecular_function,Binding to an epidermal growth factor receptor. [GOC:ai]
GO:0005158,insulin receptor binding,molecular_function,Binding to an insulin receptor. [GOC:ai]
GO:0005164,tumor necrosis factor receptor binding,molecular_function,Binding to a tumor necrosis factor receptor. [GOC:ai]
GO:0005178,integrin binding,molecular_function,Binding to an integrin. [GOC:ceb]
GO:0005179,hormone activity,molecular_function,"The action characteristic of a hormone, any substance formed in very small amounts in one specialized organ or group of cells and carried (sometimes in the bloodstream) to another organ or group of cells in the same organism, upon which it has a specific regulatory action. The term was originally applied to agents with a stimulatory physiological action in vertebrate animals (as opposed to a chalone, which has a depressant action). Usage is now extended to regulatory compounds in lower animals and plants, and to synthetic substances having comparable effects; all bind receptors and trigger some biological process. [GOC:dph, GOC:mah, ISBN:0198506732]"
GO:0005184,neuropeptide hormone activity,molecular_function,"The action characteristic of a neuropeptide hormone, any peptide hormone that acts in the central nervous system. A neuropeptide is any of several types of molecules found in brain tissue, composed of short chains of amino acids; they include endorphins, enkephalins, vasopressin, and others. They are often localized in axon terminals at synapses and are classified as putative neurotransmitters, although some are also hormones. [GOC:mah]"
GO:0005198,structural molecule activity,molecular_function,"The action of a molecule that contributes to the structural integrity of a complex. [GOC:mah, GOC:vw]"
GO:0005200,structural constituent of cytoskeleton,molecular_function,The action of a molecule that contributes to the structural integrity of a cytoskeletal structure. [GOC:mah]
GO:0005201,extracellular matrix structural constituent,molecular_function,The action of a molecule that contributes to the structural integrity of the extracellular matrix. [GOC:mah]
GO:0005212,structural constituent of eye lens,molecular_function,The action of a molecule that contributes to the structural integrity of the lens of an eye. [GOC:mah]
GO:0005242,inward rectifier potassium channel activity,molecular_function,"Enables the transmembrane transfer of a potassium ion by an inwardly-rectifying voltage-gated channel. An inwardly rectifying current-voltage relation is one where at any given driving force the inward flow of K+ ions exceeds the outward flow for the opposite driving force. The inward-rectification is due to a voltage-dependent block of the channel pore by a specific ligand or ligands, and as a result the macroscopic conductance depends on the difference between membrane voltage and the K+ equilibrium potential rather than on membrane voltage itself. [GOC:cb, GOC:mah, PMID:14977398]"
GO:0005244,voltage-gated monoatomic ion channel activity,molecular_function,"Enables the transmembrane transfer of an ion by a voltage-gated channel. An ion is an atom or group of atoms carrying an electric charge by virtue of having gained or lost one or more electrons. A voltage-gated channel is a channel whose open state is dependent on the voltage across the membrane in which it is embedded. [GOC:mtg_transport, ISBN:0198506732, ISBN:0815340729]"
GO:0005245,voltage-gated calcium channel activity,molecular_function,"Enables the transmembrane transfer of a calcium ion by a voltage-gated channel. A voltage-gated channel is a channel whose open state is dependent on the voltage across the membrane in which it is embedded. [GOC:mtg_transport, GOC:tb, ISBN:0815340729]"
GO:0005246,calcium channel regulator activity,molecular_function,Modulates the activity of a calcium channel. [GOC:mah]
GO:0005249,voltage-gated potassium channel activity,molecular_function,"Enables the transmembrane transfer of a potassium ion by a voltage-gated channel. A voltage-gated channel is a channel whose open state is dependent on the voltage across the membrane in which it is embedded. [GOC:mtg_transport, ISBN:0815340729]"
GO:0005251,delayed rectifier potassium channel activity,molecular_function,"Enables the transmembrane transfer of a potassium ion by a delayed rectifying voltage-gated channel. A delayed rectifying current-voltage relation is one where channel activation kinetics are time-dependent, and inactivation is slow. [GOC:mah, PMID:11343411, PMID:2462513]"
GO:0005254,chloride channel activity,molecular_function,"Enables the facilitated diffusion of a chloride (by an energy-independent process) involving passage through a transmembrane aqueous pore or channel without evidence for a carrier-mediated mechanism. [GOC:mtg_transport, GOC:pr, ISBN:0815340729]"
GO:0005261,monoatomic cation channel activity,molecular_function,"Enables the energy-independent passage of monoatomic cations across a lipid bilayer down a concentration gradient. [GOC:def, GOC:dph, GOC:mtg_transport, GOC:pr, ISBN:0815340729]"
GO:0005262,calcium channel activity,molecular_function,"Enables the facilitated diffusion of a calcium ion (by an energy-independent process) involving passage through a transmembrane aqueous pore or channel without evidence for a carrier-mediated mechanism. [GOC:mtg_transport, GOC:pr, ISBN:0815340729]"
GO:0005267,potassium channel activity,molecular_function,"Enables the facilitated diffusion of a potassium ion (by an energy-independent process) involving passage through a transmembrane aqueous pore or channel without evidence for a carrier-mediated mechanism. [GOC:BHF, GOC:mtg_transport, GOC:pr, ISBN:0815340729]"
GO:0005319,lipid transporter activity,molecular_function,"Enables the directed movement of lipids into, out of or within a cell, or between cells. [GOC:ai]"
GO:0005385,zinc ion transmembrane transporter activity,molecular_function,Enables the transfer of zinc (Zn) ions from one side of a membrane to the other. [GOC:dgf]
GO:0005484,SNAP receptor activity,molecular_function,"Acting as a marker to identify a membrane and interacting selectively with one or more SNAREs on another membrane to mediate membrane fusion. [GOC:mah, PMID:14570579]"
GO:0005496,steroid binding,molecular_function,"Binding to a steroid, any of a large group of substances that have in common a ring system based on 1,2-cyclopentanoperhydrophenanthrene. [GOC:jl, ISBN:0198506732]"
GO:0005504,fatty acid binding,molecular_function,"Binding to a fatty acid, an aliphatic monocarboxylic acids liberated from naturally occurring fats and oils by hydrolysis. [ISBN:0198506732]"
GO:0005506,iron ion binding,molecular_function,Binding to an iron (Fe) ion. [GOC:ai]
GO:0005507,copper ion binding,molecular_function,Binding to a copper (Cu) ion. [GOC:ai]
GO:0005516,calmodulin binding,molecular_function,"Binding to calmodulin, a calcium-binding protein with many roles, both in the calcium-bound and calcium-free states. [GOC:krc]"
GO:0005518,collagen binding,molecular_function,"Binding to collagen, a group of fibrous proteins of very high tensile strength that form the main component of connective tissue in animals. Collagen is highly enriched in glycine (some regions are 33% glycine) and proline, occurring predominantly as 3-hydroxyproline (about 20%). [GOC:ai, ISBN:0198506732]"
GO:0005525,GTP binding,molecular_function,"Binding to GTP, guanosine triphosphate. [GOC:ai]"
GO:0005537,mannose binding,molecular_function,"Binding to mannose, a monosaccharide hexose, stereoisomeric with glucose, that occurs naturally only in polymerized forms called mannans. [GOC:jl, ISBN:0192800981]"
GO:0005539,glycosaminoglycan binding,molecular_function,"Binding to a glycan (polysaccharide) containing a substantial proportion of aminomonosaccharide residues. [GOC:jl, ISBN:0198506732]"
GO:0005540,hyaluronic acid binding,molecular_function,"Binding to hyaluronic acid, a polymer composed of repeating dimeric units of glucuronic acid and N-acetyl glucosamine. [GOC:jl]"
GO:0005543,phospholipid binding,molecular_function,"Binding to a phospholipid, a class of lipids containing phosphoric acid as a mono- or diester. [ISBN:0198506732]"
GO:0005544,calcium-dependent phospholipid binding,molecular_function,"Binding to a phospholipid, a class of lipids containing phosphoric acid as a mono- or diester, in the presence of calcium. [GOC:jl]"
GO:0005546,"phosphatidylinositol-4,5-bisphosphate binding",molecular_function,"Binding to phosphatidylinositol-4,5-bisphosphate, a derivative of phosphatidylinositol in which the inositol ring is phosphorylated at the 4' and 5' positions. [GOC:bf, GOC:jl]"
GO:0005547,"phosphatidylinositol-3,4,5-trisphosphate binding",molecular_function,"Binding to phosphatidylinositol-3,4,5-trisphosphate, a derivative of phosphatidylinositol in which the inositol ring is phosphorylated at the 3', 4' and 5' positions. [GOC:bf, GOC:jl]"
GO:0005549,odorant binding,molecular_function,"Binding to an odorant, any substance capable of stimulating the sense of smell. [GOC:jl, ISBN:0721662544]"
GO:0008009,chemokine activity,molecular_function,"The function of a family of small chemotactic cytokines; their name is derived from their ability to induce directed chemotaxis in nearby responsive cells. All chemokines possess a number of conserved cysteine residues involved in intramolecular disulfide bond formation. Some chemokines are considered pro-inflammatory and can be induced during an immune response to recruit cells of the immune system to a site of infection, while others are considered homeostatic and are involved in controlling the migration of cells during normal processes of tissue maintenance or development. Chemokines are found in all vertebrates, some viruses and some bacteria. [GOC:BHF, GOC:rl, PMID:12183377, Wikipedia:Chemokine]"
GO:0008013,beta-catenin binding,molecular_function,Binding to a catenin beta subunit. [GOC:bf]
GO:0008017,microtubule binding,molecular_function,"Binding to a microtubule, a filament composed of tubulin monomers. [GOC:krc]"
GO:0008022,obsolete protein C-terminus binding,molecular_function,"OBSOLETE. Binding to a protein C-terminus, the end of a peptide chain at which the 1-carboxyl function of a constituent amino acid is not attached in peptide linkage to another amino-acid residue. [ISBN:0198506732]"
GO:0008047,enzyme activator activity,molecular_function,"Binds to and increases the activity of an enzyme. [GOC:dph, GOC:mah, GOC:tb]"
GO:0008083,growth factor activity,molecular_function,The function that stimulates a cell to grow or proliferate. Most growth factors have other actions besides the induction of cell growth or proliferation. [ISBN:0815316194]
GO:0008092,cytoskeletal protein binding,molecular_function,"Binding to a protein component of a cytoskeleton (actin, microtubule, or intermediate filament cytoskeleton). [GOC:mah]"
GO:0008093,cytoskeletal anchor activity,molecular_function,"The binding activity of a protein that brings together a cytoskeletal protein (either a microtubule or actin filament, spindle pole body, or protein directly bound to them) and one or more other molecules, permitting them to function in a coordinated way. [GOC:mtg_MIT_16mar07, PMID:30323238]"
GO:0008094,"ATP-dependent activity, acting on DNA",molecular_function,"Catalytic activity that acts to modify DNA, driven by ATP hydrolysis. [GOC:pdt]"
GO:0008134,transcription factor binding,molecular_function,"Binding to a transcription factor, a protein required to initiate or regulate transcription. [ISBN:0198506732]"
GO:0008135,"translation factor activity, RNA binding",molecular_function,"Functions during translation by binding to RNA during polypeptide synthesis at the ribosome. [GOC:ai, GOC:vw]"
GO:0008137,NADH dehydrogenase (ubiquinone) activity,molecular_function,Catalysis of the reaction: NADH + ubiquinone + 5 H+(in) = NAD+ + ubiquinol + 4 H+(out). [RHEA:29091]
GO:0008138,protein tyrosine/serine/threonine phosphatase activity,molecular_function,Catalysis of the reactions: protein serine + H2O = protein serine + phosphate; protein threonine phosphate + H2O = protein threonine + phosphate; and protein tyrosine phosphate + H2O = protein tyrosine + phosphate. [GOC:mah]
GO:0008139,nuclear localization sequence binding,molecular_function,"Binding to a nuclear localization sequence, a specific peptide sequence that acts as a signal to localize the protein within the nucleus. [GOC:ai]"
GO:0008143,poly(A) binding,molecular_function,"Binding to a sequence of adenylyl residues in an RNA molecule, such as the poly(A) tail, a sequence of adenylyl residues at the 3' end of eukaryotic mRNA. [GOC:jl]"
GO:0008146,sulfotransferase activity,molecular_function,"Catalysis of the transfer of a sulfate group from 3'-phosphoadenosine 5'-phosphosulfate to the hydroxyl group of an acceptor, producing the sulfated derivative and 3'-phosphoadenosine 5'-phosphate. [GOC:curators]"
GO:0008157,protein phosphatase 1 binding,molecular_function,Binding to a protein phosphatase 1. [GOC:jl]
GO:0008168,methyltransferase activity,molecular_function,Catalysis of the transfer of a methyl group to an acceptor molecule. [ISBN:0198506732]
GO:0008188,neuropeptide receptor activity,molecular_function,Combining with a neuropeptide to initiate a change in cell activity. [GOC:ai]
GO:0008198,ferrous iron binding,molecular_function,"Binding to a ferrous iron ion, Fe(II). [GOC:ai]"
GO:0008201,heparin binding,molecular_function,"Binding to heparin, a member of a group of glycosaminoglycans found mainly as an intracellular component of mast cells and which consist predominantly of alternating alpha-(1->4)-linked D-galactose and N-acetyl-D-glucosamine-6-sulfate residues. [GOC:jl, ISBN:0198506732]"
GO:0008233,peptidase activity,molecular_function,"Catalysis of the hydrolysis of a peptide bond. A peptide bond is a covalent bond formed when the carbon atom from the carboxyl group of one amino acid shares electrons with the nitrogen atom from the amino group of a second amino acid. [GOC:jl, ISBN:0815332181]"
GO:0008234,cysteine-type peptidase activity,molecular_function,"Catalysis of the hydrolysis of peptide bonds in a polypeptide chain by a mechanism in which the sulfhydryl group of a cysteine residue at the active center acts as a nucleophile. [GOC:mah, https://www.ebi.ac.uk/merops/about/glossary.shtml#CATTYPE]"
GO:0008236,serine-type peptidase activity,molecular_function,Catalysis of the hydrolysis of peptide bonds in a polypeptide chain by a catalytic mechanism that involves a catalytic triad consisting of a serine nucleophile that is activated by a proton relay involving an acidic residue (e.g. aspartate or glutamate) and a basic residue (usually histidine). [https://www.ebi.ac.uk/merops/about/glossary.shtml#CATTYPE]
GO:0008237,metallopeptidase activity,molecular_function,"Catalysis of the hydrolysis of peptide bonds by a mechanism in which water acts as a nucleophile, one or two metal ions hold the water molecule in place, and charged amino acid side chains are ligands for the metal ions. [GOC:mah, https://www.ebi.ac.uk/merops/about/glossary.shtml#CATTYPE]"
GO:0008266,poly(U) RNA binding,molecular_function,Binding to a sequence of uracil residues in an RNA molecule. [GOC:mah]
GO:0008289,lipid binding,molecular_function,Binding to a lipid. [GOC:ai]
GO:0008307,structural constituent of muscle,molecular_function,The action of a molecule that contributes to the structural integrity of a muscle fiber. [GOC:mah]
GO:0008320,protein transmembrane transporter activity,molecular_function,Enables the transfer of a protein from one side of a membrane to the other. [GOC:jl]
GO:0008327,methyl-CpG binding,molecular_function,"Binding to a methylated cytosine/guanine dinucleotide. [GOC:jl, PMID:11746232]"
GO:0008331,high voltage-gated calcium channel activity,molecular_function,"Enables the transmembrane transfer of a calcium ion by a high voltage-gated channel. A high voltage-gated channel is a channel whose open state is dependent on high voltage across the membrane in which it is embedded. [GOC:mtg_transport, ISBN:0815340729, PMID:16382099]"
GO:0008375,acetylglucosaminyltransferase activity,molecular_function,Catalysis of the transfer of an N-acetylglucosaminyl residue from UDP-N-acetyl-glucosamine to a sugar. [ISBN:0198506732]
GO:0008514,organic anion transmembrane transporter activity,molecular_function,Enables the transfer of organic anions from one side of a membrane to the other. Organic anions are atoms or small molecules with a negative charge which contain carbon in covalent linkage. [GOC:ai]
GO:0008528,G protein-coupled peptide receptor activity,molecular_function,"Combining with a peptide and transmitting the signal across the membrane by activating an associated G-protein; promotes the exchange of GDP for GTP on the alpha subunit of a heterotrimeric G-protein complex. [GOC:dph, GOC:tb]"
GO:0008574,plus-end-directed microtubule motor activity,molecular_function,"A motor activity that generates movement along a microtubule toward the plus end, driven by ATP hydrolysis. [GOC:vw, PMID:32842864]"
GO:0008656,cysteine-type endopeptidase activator activity involved in apoptotic process,molecular_function,"Binds to and increases the rate of proteolysis catalyzed by a cysteine-type endopeptidase involved in the apoptotic process. [GOC:mah, GOC:mtg_apoptosis]"
GO:0009055,electron transfer activity,molecular_function,"A molecular function representing the directed movement of electrons from one molecular entity to another, typically mediated by electron carriers or acceptors, resulting in the transfer of energy and/or the reduction-oxidation (redox) transformation of chemical species. This activity is fundamental to various biological processes, including cellular respiration and photosynthesis, as well as numerous enzymatic reactions involved in metabolic pathways. [Wikipedia:Electron_transfer]"
GO:0010314,phosphatidylinositol-5-phosphate binding,molecular_function,"Binding to phosphatidylinositol-5-phosphate, a derivative of phosphatidylinositol in which the inositol ring is phosphorylated at the 5' position. [GOC:bf, GOC:tair_curators]"
GO:0015020,glucuronosyltransferase activity,molecular_function,Catalysis of the reaction: UDP-glucuronate + acceptor = UDP + acceptor beta-D-glucuronoside. [RHEA:21032]
GO:0015026,coreceptor activity,molecular_function,"Combining with an extracellular or intracellular messenger, and in cooperation with a nearby primary receptor, initiating a change in cell activity. [GOC:go_curators]"
GO:0015035,protein-disulfide reductase activity,molecular_function,Catalysis of the reaction: a protein with reduced sulfide groups = a protein with oxidized disulfide bonds. [PMID:7559385]
GO:0015171,amino acid transmembrane transporter activity,molecular_function,"Enables the transfer of amino acids from one side of a membrane to the other. Amino acids are organic molecules that contain an amino group and a carboxyl group. [GOC:ai, GOC:mtg_transport, ISBN:0815340729]"
GO:0015293,symporter activity,molecular_function,"Enables the active transport of a solute across a membrane by a mechanism whereby two or more species are transported together in the same direction in a tightly coupled process not directly linked to a form of energy other than chemiosmotic energy. [GOC:mtg_transport, ISBN:0815340729, PMID:10839820]"
GO:0015297,antiporter activity,molecular_function,"Enables the active transport of a solute across a membrane by a mechanism whereby two or more species are transported in opposite directions in a tightly coupled process not directly linked to a form of energy other than chemiosmotic energy. The reaction is: solute A(out) + solute B(in) = solute A(in) + solute B(out). [GOC:mtg_transport, ISBN:0815340729, PMID:10839820]"
GO:0015459,potassium channel regulator activity,molecular_function,"Binds to and modulates the activity of a potassium channel. [GOC:dos, GOC:mah]"
GO:0015485,cholesterol binding,molecular_function,"Binding to cholesterol (cholest-5-en-3-beta-ol); the principal sterol of vertebrates and the precursor of many steroids, including bile acids and steroid hormones. [GOC:jl, ISBN:0198506732]"
GO:0015631,tubulin binding,molecular_function,"Binding to monomeric or multimeric forms of tubulin, including microtubules. [GOC:clt]"
GO:0016018,cyclosporin A binding,molecular_function,"Binding to cyclosporin A, a cyclic undecapeptide that contains several N-methylated and unusual amino acids. [GOC:mb]"
GO:0016251,RNA polymerase II general transcription initiation factor activity,molecular_function,"A general transcription initiation factor activity that contributes to transcription start site selection and transcription initiation of genes transcribed by RNA polymerase II. The general transcription factors for RNA polymerase II include TFIIB, TFIID, TFIIE, TFIIF, TFIIH and TATA-binding protein (TBP). In most species, RNA polymerase II transcribes all messenger RNAs (mRNAs), most untranslated regulatory RNAs, the majority of the snoRNAs, four of the five snRNAs (U1, U2, U4, and U5), and other small noncoding RNAs. For some small RNAs there is variability between species as to whether it is transcribed by RNA polymerase II or RNA polymerase III. However there are also rare exceptions, such as Trypanosoma brucei, where RNA polymerase I transcribes certain mRNAs in addition to its normal role in rRNA transcription. [GOC:txnOH-2018, PMID:10384286, PMID:10747032, PMID:23442138, PMID:25693126]"
GO:0016279,protein-lysine N-methyltransferase activity,molecular_function,Catalysis of the transfer of a methyl group from S-adenosyl-L-methionine to the epsilon-amino group of a lysine residue in a protein substrate. [PMID:12054878]
GO:0016301,kinase activity,molecular_function,"Catalysis of the transfer of a phosphate group, usually from ATP, to a substrate molecule. [ISBN:0198506732]"
GO:0016491,oxidoreductase activity,molecular_function,"Catalysis of an oxidation-reduction (redox) reaction, a reversible chemical reaction in which the oxidation state of an atom or atoms within a molecule is altered. One substrate acts as a hydrogen or electron donor and becomes oxidized, while the other acts as hydrogen or electron acceptor and becomes reduced. [GOC:go_curators]"
GO:0016538,cyclin-dependent protein serine/threonine kinase regulator activity,molecular_function,"Modulates the activity of a cyclin-dependent protein serine/threonine kinase, enzymes of the protein kinase family that are regulated through association with cyclins and other proteins. [GOC:pr, GOC:rn, PMID:7877684, PMID:9442875]"
GO:0016616,"oxidoreductase activity, acting on the CH-OH group of donors, NAD or NADP as acceptor",molecular_function,"Catalysis of an oxidation-reduction (redox) reaction in which a CH-OH group acts as a hydrogen or electron donor and reduces NAD+ or NADP. [EC:1.1.1.-, GOC:ai]"
GO:0016712,"oxidoreductase activity, acting on paired donors, with incorporation or reduction of molecular oxygen, reduced flavin or flavoprotein as one donor, and incorporation of one atom of oxygen",molecular_function,"Catalysis of an oxidation-reduction (redox) reaction in which hydrogen or electrons are transferred from reduced flavin or flavoprotein and one other donor, and one atom of oxygen is incorporated into one donor. [GOC:mah]"
GO:0016740,transferase activity,molecular_function,"Catalysis of the transfer of a group, e.g. a methyl group, glycosyl group, acyl group, phosphorus-containing, or other groups, from one compound (generally regarded as the donor) to another compound (generally regarded as the acceptor). Transferase is the systematic name for any enzyme of EC class 2. [ISBN:0198506732]"
GO:0016746,acyltransferase activity,molecular_function,"Catalysis of the transfer of an acyl group from one compound (donor) to another (acceptor). [GOC:jl, ISBN:0198506732]"
GO:0016779,nucleotidyltransferase activity,molecular_function,Catalysis of the transfer of a nucleotidyl group to a reactant. [ISBN:0198506732]
GO:0016787,hydrolase activity,molecular_function,"Catalysis of the hydrolysis of various bonds, e.g. C-O, C-N, C-C, phosphoric anhydride bonds, etc. [ISBN:0198506732]"
GO:0016791,phosphatase activity,molecular_function,"Catalysis of the hydrolysis of phosphoric monoesters, releasing inorganic phosphate. [GOC:curators, GOC:pg]"
