id,name,namespace,def
GO:0050321,tau-protein kinase activity,molecular_function,"Catalysis of the reaction: ATP + tau-protein = ADP + O-phospho-tau-protein. [EC:2.7.11.26, MetaCyc:TAU-PROTEIN-KINASE-RXN]"
GO:0050431,transforming growth factor beta binding,molecular_function,"Binding to TGF-beta, transforming growth factor beta, a multifunctional peptide that controls proliferation, differentiation and other functions in many cell types. [ISBN:0198506732]"
GO:0050660,flavin adenine dinucleotide binding,molecular_function,"Binding to FAD, flavin-adenine dinucleotide, the coenzyme or the prosthetic group of various flavoprotein oxidoreductase enzymes, in either the oxidized form, FAD, or the reduced form, FADH2. [GOC:ai, GOC:imk, ISBN:0198506732]"
GO:0050661,NADP binding,molecular_function,"Binding to nicotinamide-adenine dinucleotide phosphate, a coenzyme involved in many redox and biosynthetic reactions; binding may be to either the oxidized form, NADP+, or the reduced form, NADPH. [GOC:ai]"
GO:0050681,nuclear androgen receptor binding,molecular_function,Binding to a nuclear androgen receptor. [GOC:ai]
GO:0050699,WW domain binding,molecular_function,"Binding to a WW domain of a protein, a small module composed of 40 amino acids and plays a role in mediating protein-protein interactions via proline-rich regions. [PMID:14531730]"
GO:0050750,low-density lipoprotein particle receptor binding,molecular_function,Binding to a low-density lipoprotein receptor. [GOC:ai]
GO:0050839,cell adhesion molecule binding,molecular_function,Binding to a cell adhesion molecule. [GOC:ai]
GO:0050840,extracellular matrix binding,molecular_function,Binding to a component of the extracellular matrix. [GOC:ai]
GO:0051010,microtubule plus-end binding,molecular_function,"Binding to the plus end of a microtubule. [GOC:ai, PMID:14557818, PMID:14614826]"
GO:0051015,actin filament binding,molecular_function,"Binding to an actin filament, also known as F-actin, a helical filamentous polymer of globular G-actin subunits. [ISBN:0198506732]"
GO:0051018,protein kinase A binding,molecular_function,Binding to a protein kinase A. [GOC:ai]
GO:0051019,mitogen-activated protein kinase binding,molecular_function,Binding to a mitogen-activated protein kinase. [GOC:ai]
GO:0051020,GTPase binding,molecular_function,"Binding to a GTPase, any enzyme that catalyzes the hydrolysis of GTP. [GOC:ai]"
GO:0051059,NF-kappaB binding,molecular_function,"Binding to NF-kappaB, a transcription factor for eukaryotic RNA polymerase II promoters. [GOC:ai]"
GO:0051082,unfolded protein binding,molecular_function,Binding to an unfolded protein. [GOC:ai]
GO:0051087,protein-folding chaperone binding,molecular_function,"Binding to a chaperone protein, a class of proteins that bind to nascent or unfolded polypeptides and ensure correct folding or transport. [PMID:10585443]"
GO:0051117,ATPase binding,molecular_function,"Binding to an ATPase, any enzyme that catalyzes the hydrolysis of ATP. [GOC:ai]"
GO:0051219,phosphoprotein binding,molecular_function,Binding to a phosphorylated protein. [GOC:ai]
GO:0051287,NAD binding,molecular_function,"Binding to nicotinamide adenine dinucleotide, a coenzyme involved in many redox and biosynthetic reactions; binding may be to either the oxidized form, NAD+, or the reduced form, NADH. [GOC:ai]"
GO:0051537,"2 iron, 2 sulfur cluster binding",molecular_function,"Binding to a 2 iron, 2 sulfur (2Fe-2S) cluster; this cluster consists of two iron atoms, with two inorganic sulfur atoms found between the irons and acting as bridging ligands. [GOC:ai, PMID:15952888, Wikipedia:Iron-sulfur_cluster]"
GO:0051539,"4 iron, 4 sulfur cluster binding",molecular_function,"Binding to a 4 iron, 4 sulfur (4Fe-4S) cluster; this cluster consists of four iron atoms, with the inorganic sulfur atoms found between the irons and acting as bridging ligands. [GOC:ai, PMID:15952888, Wikipedia:Iron-sulfur_cluster]"
GO:0051721,protein phosphatase 2A binding,molecular_function,Binding to protein phosphatase 2A. [GOC:ai]
GO:0051787,misfolded protein binding,molecular_function,Binding to a misfolded protein. [GOC:ai]
GO:0051879,Hsp90 protein binding,molecular_function,"Binding to Hsp90 proteins, any of a group of heat shock proteins around 90kDa in size. [GOC:ai]"
GO:0051959,dynein light intermediate chain binding,molecular_function,Binding to a light intermediate chain of the dynein complex. [GOC:bf]
GO:0060090,molecular adaptor activity,molecular_function,"The binding activity of a molecule that brings together two or more molecules through a selective, non-covalent, often stoichiometric interaction, permitting those molecules to function in a coordinated way. [GOC:mtg_MIT_16mar07, GOC:vw]"
GO:0061629,RNA polymerase II-specific DNA-binding transcription factor binding,molecular_function,"Binding to a sequence-specific DNA binding RNA polymerase II transcription factor, any of the factors that interact selectively and non-covalently with a specific DNA sequence in order to modulate transcription. [GOC:dph, GOC:vw]"
GO:0061630,ubiquitin protein ligase activity,molecular_function,"Catalysis of the transfer of ubiquitin to a substrate protein via the reaction X-ubiquitin + S = X + S-ubiquitin, where X is either an E2 or E3 enzyme, the X-ubiquitin linkage is a thioester bond, and the S-ubiquitin linkage is an amide bond: an isopeptide bond between the C-terminal glycine of ubiquitin and the epsilon-amino group of lysine residues in the substrate or, in the linear extension of ubiquitin chains, a peptide bond the between the C-terminal glycine and N-terminal methionine of ubiquitin residues. [GOC:BioGRID, GOC:dph, GOC:mah, GOC:tb, PMID:22863777]"
GO:0061631,ubiquitin conjugating enzyme activity,molecular_function,"Isoenergetic transfer of ubiquitin from one protein to another via the reaction X-ubiquitin + Y = Y-ubiquitin + X, where both the X-ubiquitin and Y-ubiquitin linkages are thioester bonds between the C-terminal glycine of ubiquitin and a sulfhydryl side group of a cysteine residue. [GOC:BioGRID, GOC:dph]"
GO:0070006,metalloaminopeptidase activity,molecular_function,"Catalysis of the hydrolysis of a single N-terminal amino acid residue from a polypeptide chain by a mechanism in which water acts as a nucleophile, one or two metal ions hold the water molecule in place, and charged amino acid side chains are ligands for the metal ions. [https://www.ebi.ac.uk/merops/about/glossary.shtml#AMINOPEPTIDASE]"
GO:0070034,telomerase RNA binding,molecular_function,"Binding to the telomerase RNA template. [GOC:krc, PMID:16884717]"
GO:0070182,DNA polymerase binding,molecular_function,"Binding to a DNA polymerase. [GOC:BHF, GOC:mah]"
GO:0070273,phosphatidylinositol-4-phosphate binding,molecular_function,"Binding to phosphatidylinositol-4-phosphate, a derivative of phosphatidylinositol in which the inositol ring is phosphorylated at the 4' position. [GOC:bf, GOC:mah]"
GO:0070300,phosphatidic acid binding,molecular_function,"Binding to phosphatidic acid, any of a class of glycerol phosphate in which both the remaining hydroxyl groups of the glycerol moiety are esterified with fatty acids. [CHEBI:16337, GOC:jp, ISBN:0198506732]"
GO:0070330,aromatase activity,molecular_function,Catalysis of the reduction of an aliphatic ring to yield an aromatic ring. [GOC:cb]
GO:0070412,R-SMAD binding,molecular_function,"Binding to a receptor-regulated SMAD signaling protein. [GOC:BHF, GOC:vk, PMID:19114992]"
GO:0070530,K63-linked polyubiquitin modification-dependent protein binding,molecular_function,"Binding to a protein upon poly-ubiquitination formed by linkages between lysine residues at position 63 in the target protein. [GOC:mah, PMID:15556404, PMID:17525341]"
GO:0070577,lysine-acetylated histone binding,molecular_function,"Binding to a histone in which a lysine residue has been modified by acetylation. [GOC:BHF, GOC:mah, GOC:rl, PMID:17582821]"
GO:0070840,dynein complex binding,molecular_function,"Binding to a dynein complex, a protein complex that contains two or three dynein heavy chains and several light chains, and has microtubule motor activity. [GOC:bf, GOC:BHF, GOC:mah]"
GO:0070888,E-box binding,molecular_function,"Binding to an E-box, a DNA motif with the consensus sequence CANNTG that is found in the promoters of a wide array of genes expressed in neurons, muscle and other tissues. [GOC:BHF, GOC:vk, PMID:11812799]"
GO:0071889,14-3-3 protein binding,molecular_function,"Binding to a 14-3-3 protein. A 14-3-3 protein is any of a large family of approximately 30kDa acidic proteins which exist primarily as homo- and heterodimers within all eukaryotic cells, and have been implicated in the modulation of distinct biological processes by binding to specific phosphorylated sites on diverse target proteins, thereby forcing conformational changes or influencing interactions between their targets and other molecules. Each 14-3-3 protein sequence can be roughly divided into three sections: a divergent amino terminus, the conserved core region and a divergent carboxy-terminus. The conserved middle core region of the 14-3-3s encodes an amphipathic groove that forms the main functional domain, a cradle for interacting with client proteins. [GOC:cna, GOC:mah, PMID:15167810, PMID:19575580]"
GO:0071949,FAD binding,molecular_function,"Binding to the oxidized form, FAD, of flavin-adenine dinucleotide, the coenzyme or the prosthetic group of various flavoprotein oxidoreductase enzymes. [GOC:mah]"
GO:0080025,"phosphatidylinositol-3,5-bisphosphate binding",molecular_function,"Binding to phosphatidylinositol-3,5-bisphosphate, a derivative of phosphatidylinositol in which the inositol ring is phosphorylated at the 3' and 5' positions. [GOC:bf, PMID:18397324]"
GO:0097110,scaffold protein binding,molecular_function,"Binding to a scaffold protein. Scaffold proteins are crucial regulators of many key signaling pathways. Although not strictly defined in function, they are known to interact and/or bind with multiple members of a signaling pathway, tethering them into complexes. [GOC:BHF, GOC:sjp, PMID:10433269, Wikipedia:Scaffold_protein]"
GO:0097602,cullin family protein binding,molecular_function,"Binding to a member of the cullin family, hydrophobic proteins that act as scaffolds for ubiquitin ligases (E3). [GOC:ha, InterPro:IPR016158, PMID:18698375]"
GO:0097718,disordered domain specific binding,molecular_function,"Binding to a disordered domain of a protein. [GOC:gg, PMID:11746698]"
GO:0098632,cell-cell adhesion mediator activity,molecular_function,"The binding by a cell-adhesion protein on the cell surface to an extracellular matrix component, to mediate adhesion of the cell to another cell. [Wikipedia:Cell_adhesion]"
GO:0106310,protein serine kinase activity,molecular_function,Catalysis of the reactions: ATP + protein serine = ADP + protein serine phosphate. [RHEA:17989]
GO:0120020,cholesterol transfer activity,molecular_function,"Removes cholesterol from a membrane or a monolayer lipid particle, transports it through the aqueous phase while protected in a hydrophobic pocket, and brings it to an acceptor membrane or lipid particle. [GOC:krc, PMID:20823909, PMID:24220498, PMID:25797198]"
GO:0140297,DNA-binding transcription factor binding,molecular_function,"Binding to a DNA-binding transcription factor, a protein that interacts with a specific DNA sequence (sometimes referred to as a motif) within the regulatory region of a gene to modulate transcription. [GOC:txnOH-2018]"
GO:0140359,ABC-type transporter activity,molecular_function,Primary active transporter characterized by two nucleotide-binding domains and two transmembrane domains. Uses the energy generated from ATP hydrolysis to drive the transport of a substance across a membrane. [PMID:26517899]
GO:0140416,transcription regulator inhibitor activity,molecular_function,A molecular function regulator that inhibits the activity of a transcription regulator via direct binding and/or post-translational modification. [PMID:10652346]
GO:0140658,ATP-dependent chromatin remodeler activity,molecular_function,"An activity, driven by ATP hydrolysis, that modulates the contacts between histones and DNA, resulting in a change in chromosome architecture within the nucleosomal array, leading to chromatin remodeling. [PMID:14729263, PMID:19165147, PMID:21862382, PMID:30867599, PMID:34313222]"
GO:0140662,ATP-dependent protein folding chaperone,molecular_function,"Binding to a protein or a protein-containing complex to assist the protein folding process, driven by ATP hydrolysis. [PMID:27365453]"
GO:0140677,molecular function activator activity,molecular_function,A molecular function regulator that activates or increases the activity of its target via non-covalent binding that does not result in covalent modification to the target. [GOC:curators]
GO:0140678,molecular function inhibitor activity,molecular_function,A molecular function regulator that inhibits or decreases the activity of its target via non-covalent binding that does not result in covalent modification to the target. [GOC:curators]
GO:1901981,phosphatidylinositol phosphate binding,molecular_function,"Binding to phosphatidylinositol phosphate. [GOC:TermGenie, PMID:23445487]"
GO:1904315,transmitter-gated monoatomic ion channel activity involved in regulation of postsynaptic membrane potential,molecular_function,"Any transmitter-gated ion channel activity that is involved in regulation of postsynaptic membrane potential. [GO_REF:0000061, GOC:TermGenie, PMID:20200227]"
GO:1990381,ubiquitin-specific protease binding,molecular_function,"Binding to a ubiquitin-specific protease. [GOC:bf, GOC:PARL, PMID:24063750]"
GO:1990404,NAD+-protein ADP-ribosyltransferase activity,molecular_function,Catalysis of the reaction: amino acyl-[protein] + NAD+ = H+ + (ADP-D-ribosyl)-amino acyl-[protein] + nicotinamide. [PMID:1899243]
GO:1990756,ubiquitin ligase-substrate adaptor activity,molecular_function,The binding activity of a molecule that brings together a ubiquitin ligase and its substrate. Usually mediated by F-box BTB/POZ domain proteins. [PMID:24658274]
GO:1990782,protein tyrosine kinase binding,molecular_function,Binding to protein tyrosine kinase. [PMID:25499537]
GO:1990841,promoter-specific chromatin binding,molecular_function,Binding to a section of chromatin that is associated with gene promoter sequences of DNA. [PMID:19948729]
